sample_id,dataset_part,source,url,published_at,published_year,published_month,title,text_fragment,entity_mention,entity_norm,risk_type_candidate,found_risk_keywords,risk_type,entity_relevance,alert_flag,alert_reason,label_quality,risk_score_v1,split,review_status,review_comment
sample_000631,risk_enriched_sample,ods_tass,https://tass.ru/ekonomika/5562131,1536868621,2018,9,"""Газпром нефть"" считает решение суда ЕС о санкциях необоснованным","""Газпром нефть"" считает решение суда ЕС о санкциях необоснованным ""Газпром нефть"" считает необоснованным решение Европейского суда общей юрисдикции в Люксембурге, который отказался удовлетворить иск компании об аннулировании санкций Евросоюза, и будет принимать решение о дальнейших действиях после детального анализа. Об этом ТАСС сообщили в ""Газпром нефти"". n""Компания считает решение суда необоснованным и несправедливым, будет принимать решение о последующих действиях после детального анализа судебного акта"", - отметили в компании. n13 сентября Европейский суд общей юрисдикции отказал Сбербанку, ВТБ и Внешэкономбанку, а также ""Роснефти"", ""Газпром нефти"" и ""Алмаз-Антею"" в аннулировании санкций Евросоюза. nОграничительные меры, которые оспаривались, были введены в июле 2014 года в связи с воссоединением Крыма с Россией и событиями на востоке Украины.",ВТБ,ВТБ,legal_regulatory,иск; суд,no_risk,mentioned_only,0,,ok,0,train,manual_checked,банк только упомянут
sample_000632,risk_enriched_sample,buriy,http://www.ruscur.ru/themes/0/00/70/7069.shtml?news/0/10/21/102130,1444413724,2015,10,Доллар упал ниже 61 рубля впервые с июля,"Доллар упал ниже 61 рубля впервые с июля Центральный банк и Министерство финансов РФ ограничили доступ крупнейших банков страны, подпавших под санкции США и Евросоюза, к собственным валютным средствам, пишет Bloomberg, ссылаясь на трех госслужащих и банкира, знакомых с введенными ограничениями. В числе банков, на которых действует ограничение – Сбербанк, ВТБ, Газпромбанк, Россельхозбанк и ВЭБ, в прошлом году попавшие под секторальные санкции США и ЕС, ограничивающие выход на европейский рынок капитала. Банки и их дочерние структуры (с долей 50% и более) не могут привлекать на Западе новый долговой и акционерный капитал сроком более 30 дней.",ВТБ,ВТБ,sanctions,санкции,no_risk,mentioned_only,0,,ok,0,train,manual_checked,банк только упомянут
sample_000633,risk_enriched_sample,ods_tass,https://tass.ru/ekonomika/2132721,1437488575,2015,7,"Сбербанк подал иск к двум ""дочкам"" ""Мечела"" на 24,6 млн рублей","Сбербанк подал иск к двум ""дочкам"" ""Мечела"" на 24,6 млн рублей МОСКВА, 21 июля. /ТАСС/.",Сбербанк,Сбербанк,legal_regulatory,иск,no_risk,mentioned_only,0,,ok,0,train,manual_checked,банк только упомянут
sample_000634,risk_enriched_sample,buriy,http://www.charter97.org/ru/news/2015/3/7/142343/,1425686400,2015,3,Власти Японии потребовали от экс-премьера страны не посещать Крым,"Власти Японии потребовали от экс-премьера страны не посещать Крым В частности, Токио ограничил экспорт оружия в Россию и запретил российским банкам страховать свои риски путем покупки японских ценных бумаг. Санкции коснулись Сбербанка, Внешэкономбанка, ВТБ, Газпромбанка и Россельхозбанка. (0) Поделись!",ВТБ,ВТБ,sanctions,санкции,no_risk,mentioned_only,0,,ok,0,train,manual_checked,банк только упомянут
sample_000635,risk_enriched_sample,buriy,http://oko-planet.su/finances/financesnews/269224-davos-vne-politiki-itogi-45-go-vsemirnogo-ekonomicheskogo-foruma.html,1422268284,2015,1,Давос вне политики: итоги 45-го Всемирного экономического форума,"Давос вне политики: итоги 45-го Всемирного экономического форума Участники Давоса эти перспективы оценивают скептически. Большинство иностранных инвесторов, которых собрала за завтраком в Давосе ""ВТБ Капитал"", выразили мнение, что действующие в отношении России европейские ограничения останутся в силе в 2015 году, а американские могут быть смягчены не ранее 2017 года. При этом европейские инвесторы ""признают как факт"", что ""Европа не выходит из рецессии именно из-за санкций в отношении России"", заявил в разговоре с РБК гендиректор РФПИ Кирилл Дмитриев.",ВТБ,ВТБ,sanctions,ограничения,no_risk,mentioned_only,0,,ok,0,train,manual_checked,банк только упомянут
sample_000636,risk_enriched_sample,buriy,http://www.vedomosti.ru/finance/news/2015/05/12/sredstva-ot-asv-v-kapital-1-go-urovnya-mogut-poluchit-gosbanki-i-banki-pod-sanktsiyami---interfaks,1431456912,2015,5,Средства от АСВ в капитал 1-го уровня могут получить госбанки и банки под санкциями - «Интерфакс»,"Средства от АСВ в капитал 1-го уровня могут получить госбанки и банки под санкциями - «Интерфакс» Средства в капитал первого уровня от Агентства по страхованию вкладов (АСВ) могут получить как государственные ВТБ, РСХБ и Газпромбанк, так и подпавшие под персональные санкции РНКБ, СМП банк и банк «Россия», а также претендующий на статус банка-санатора «Российский капитал». Об этом сообщил агентству «Интерфакс» источник в финансово-экономическом блоке правительства.",Газпромбанк,Газпромбанк,sanctions,санкции,sanctions,indirect,0,,ambiguous,45,train,manual_checked,риск относится не к банку
sample_000639,risk_enriched_sample,buriy,http://www.interfax.ru/business/435221,1428573420,2015,4,"В ""Мечеле"" прокомментировали ход переговоров с ВТБ","В ""Мечеле"" прокомментировали ход переговоров с ВТБ В настоящее время в судах рассматривается ряд исков ВТБ к ""Мечелу"" о взыскании задолженности. На ВТБ, Газпромбанк и Сбербанк приходится более половины долгов ""Мечела"" (по состоянию на конец января чистый долг группы был равен $6,3 млрд). В марте ВТБ уведомил через СМИ кредиторов ""Мечела"" о предстоящем обращении в суд с заявлением о несостоятельности компании.",Сбербанк,Сбербанк,legal_regulatory,суд,no_risk,mentioned_only,0,,ok,0,train,manual_checked,банк только упомянут
sample_000640,risk_enriched_sample,buriy,http://www.interfax.ru/business/435221,1428573420,2015,4,"В ""Мечеле"" прокомментировали ход переговоров с ВТБ","В ""Мечеле"" прокомментировали ход переговоров с ВТБ В настоящее время в судах рассматривается ряд исков ВТБ к ""Мечелу"" о взыскании задолженности. На ВТБ, Газпромбанк и Сбербанк приходится более половины долгов ""Мечела"" (по состоянию на конец января чистый долг группы был равен $6,3 млрд). В марте ВТБ уведомил через СМИ кредиторов ""Мечела"" о предстоящем обращении в суд с заявлением о несостоятельности компании.",Газпромбанк,Газпромбанк,legal_regulatory,суд,no_risk,mentioned_only,0,,ok,0,train,manual_checked,банк только упомянут
sample_000641,risk_enriched_sample,buriy,http://www.rbc.ru/rbcfreenews/55de9efb9a7947ceed44d1c1,1440652208,2015,8,Суд отказался арестовать активы Тельмана Исмаилова по иску Банка Москвы,"Суд отказался арестовать активы Тельмана Исмаилова по иску Банка Москвы Арбитражный суд Москвы отказался арестовать активы ООО «КБФ «АСТ», которое входит в группу АСТ бизнесмена Тельмана Исмаилова, на сумму более $213 млрд по иску Банка Москвы, входящего в группу ВТБ. Об этом свидетельствует информация на сайте суда.",ВТБ,ВТБ,legal_regulatory,суд,no_risk,mentioned_only,0,,ok,0,train,manual_checked,банк только упомянут
sample_000643,risk_enriched_sample,ods_tass,https://tass.ru/ekonomika/1520507,1413875799,2014,10,Центробанк: финансовое положение подпавших под санкции банков остается устойчивым,"Центробанк: финансовое положение подпавших под санкции банков остается устойчивым nАктивы банков, подпавших под действие второй волны санкций, с начала июля выросли на 4,1%. n""В случае повышения рисков ликвидности анализируемая группа банков располагает достаточным объемом обеспечения рыночных и нерыночных активов для привлечения рефинансирования в Банке России"", - сообщается в обзоре. nКакие банки подпали под санкцииnПод санкции США и ЕС подпали такие российские банки, как ВТБ, Банк Москвы и Россельхозбанк, Сбербанк, Газпромбанк и ВЭБ. nЕвропейским резидентам запрещено предоставлять этим банкам средне- и долгосрочное финансирование.",Сбербанк,Сбербанк,sanctions,санкции,sanctions,indirect,0,,ambiguous,45,train,manual_checked,риск относится не к банку
sample_000645,risk_enriched_sample,buriy,http://www.1tv.ru/news/economic/276418,1422206677,2015,1,Пристегните ремни - правительство разрабатывает антикризисный план,"Пристегните ремни - правительство разрабатывает антикризисный план С трудом, но она адаптируется к неблагоприятным условиям. Глава ВТБ Андрей Костин говорит - бизнесмены, собравшиеся здесь, санкции не приемлют. ""Однозначное мнение бизнеса, прежде всего, западноевропейского, который несет серьезные потери, в том, что санкции должны быть отменены, что вообще их введение само по себе является абсолютно неправильными методами со стороны политических властей.",ВТБ,ВТБ,sanctions,санкции,no_risk,mentioned_only,0,,ok,0,train,manual_checked,банк только упомянут
sample_000647,risk_enriched_sample,buriy,http://www.interfax.ru/business/txt.asp?id=409318,1416967200,2014,11,Счетная палата раскритиковала ЦБ за зависимость банков от денег Запада,"Счетная палата раскритиковала ЦБ за зависимость банков от денег Запада В этом году страны Запада ввели санкции в отношении некоторых российских компаний, закрыв им доступ на рынок долгосрочных кредитов. Под санкции попали в том числе крупные банки: Сбербанк, ВТБ, ВЭБ, Газпромбанк и Россельхозбанк. Также сообщалось, что в связи с ограничительными мерами доступ на рынок ""длинных"" денег ограничили для всех российских банков.",ВТБ,ВТБ,sanctions,санкции,sanctions,indirect,0,,ambiguous,45,train,manual_checked,риск относится не к банку
sample_000648,risk_enriched_sample,buriy,http://www.vesti.ru/doc.html?id=2591005,1432015980,2015,5,"Сбербанк и ВТБ хотят отсудить у ""Мечела"" 5,7 миллиарда","Сбербанк и ВТБ хотят отсудить у ""Мечела"" 5,7 миллиарда К металлургической компании ОАО ""Мечел"" поданы два новых иска. Арбитражный суд Москвы зарегистрировал иск Сбербанка о взыскании 3,8 миллиарда рублей.",ВТБ,ВТБ,legal_regulatory,суд; иск,no_risk,mentioned_only,0,,ok,0,train,manual_checked,банк только упомянут
sample_000649,risk_enriched_sample,buriy,http://www.ria.ru/economy/20150805/1163392232.html,1438772040,2015,8,Рубль продолжает попытки корректироваться вверх благодаря нефти,"Рубль продолжает попытки корректироваться вверх благодаря нефти Проблема состоит в том, что на данном этапе эта мера обсуждается на уровне слухов, в то время как Банк России пока предпочитает отмалчиваться"", — добавил он. В ходе недельного аукциона валютного РЕПО банки вчера привлекли всю предложенную сумму — впервые с начала мая, когда регулятор сократил лимит до 100 миллионов долларов, средняя ставка равнялась 2,16%, констатировал Максим Коровин из компании ""ВТБ Капитал"". ""Таким образом, объем задолженности банков перед регулятором в рамках операций валютного РЕПО останется на уровне 32,8 миллиарда долларов"", — добавил он.",ВТБ,ВТБ,legal_regulatory,регулятор,no_risk,mentioned_only,0,,ok,0,train,manual_checked,банк только упомянут
sample_000650,risk_enriched_sample,buriy,http://www.rbc.ru/rbcfreenews/55405d2c9a7947ff5cee8a10,1430281534,2015,4,"Московский арбитраж зарегистрировал иск ВТБ к «Мечелу» на 2,7 млрд руб.","Московский арбитраж зарегистрировал иск ВТБ к «Мечелу» на 2,7 млрд руб. В горнодобывающей компании во вторник заявили, что «Мечел» рассчитывает в ближайшее время завершить переговоры с банками о реструктуризации кредиторской задолженности. На начало 2015 года совокупный долг «Мечела» перед кредиторами составил $6,44 млрд. 70% долга приходится на ВТБ, Газпромбанк и Сбербанк. 9 апреля Арбитражный суд удовлетворил иск ВТБ и взыскал с «Мечела» 50,2 млрд руб. долга, в том числе 43,8 млрд руб. основного долга.",Газпромбанк,Газпромбанк,legal_regulatory,иск; суд,no_risk,mentioned_only,0,,ok,0,train,manual_checked,банк только упомянут
sample_000652,risk_enriched_sample,ods_tass,https://tass.ru/politika/5704940,1540246575,2018,10,Клинцевич: ответные меры Москвы на недружественные шаги Киева не будут формальными,"Клинцевич: ответные меры Москвы на недружественные шаги Киева не будут формальными По его мнению, экономические меры, которые должно будет разработать правительство РФ, ""создадут серьезные проблемы для физических и юридических лиц"" Украины. n""Указ прямо рекомендует Киеву перестать играть в санкционные игры"", - подчеркнул парламентарий. nС февраля 2014 года Украина уже ввела санкции против 1228 физических и 468 юридических лиц, среди которых были российские чиновники, политики, руководители предприятий, журналисты, некоторые жители Донбасса, концерн ""Алмаз-Антей"", Газпромбанк, ""Аэрофлот"" и другие компании.",Газпромбанк,Газпромбанк,sanctions,санкции,no_risk,mentioned_only,0,,ok,0,train,manual_checked,банк только упомянут
sample_000653,risk_enriched_sample,ods_tass,https://tass.ru/ekonomika/1813996,1425689113,2015,3,"""Мечел"" удивлен намерением ВТБ подать иск о банкротстве компании","""Мечел"" удивлен намерением ВТБ подать иск о банкротстве компании МОСКВА, 6 марта. /ТАСС/.",ВТБ,ВТБ,legal_regulatory,иск,no_risk,mentioned_only,0,,ok,0,train,manual_checked,банк только упомянут
sample_000654,risk_enriched_sample,buriy,http://www.gazeta.ru/business/news/2014/10/01/n_6525241.shtml,1412170545,2014,10,"Арбитражный суд Москвы зарегистрировал иск Сбербанка к ""Мечелу""","Арбитражный суд Москвы зарегистрировал иск Сбербанка к ""Мечелу"" Иск пока не принят к производству. Чистый долг «Мечела» на данный момент составляет около $8 млрд, из них $5,5 млрд приходится на Сбербанк, ВТБ и Газпромбанк. Ранее сообщалось, что ВТБ также подал в Арбитражный суд Москвы иск о взыскании с «Мечела» 2,99 млрд руб.",ВТБ,ВТБ,legal_regulatory,суд; иск,no_risk,mentioned_only,0,,ok,0,train,manual_checked,банк только упомянут
sample_000656,risk_enriched_sample,ods_tass,https://tass.ru/mezhdunarodnaya-panorama/5211702,1526653069,2018,5,Порошенко ввел в действие решение СНБО о санкциях против России,"Порошенко ввел в действие решение СНБО о санкциях против России В черные списки также попали глава ""Газпрома"" Алексей Миллер, глава ВТБ Андрей Костин, владелец ""Реновы"" Виктор Вексельберг, гендиректор ""Сургутнефтегаза"" Владимир Богданов, член правления ""Сибура"" Кирилл Шамалов, бизнесмены Игорь Ротенберг, Олег Дерипаска и Сулейман Керимов. nСанкции Украины против РоссииnУкраина ранее уже ввела санкции против 1228 физических и 468 юридических лиц, среди которых были российские чиновники, политики, руководители предприятий, журналисты, некоторые жители Донбасса, концерн ""Алмаз-Антей"", Газпромбанк, ""Аэрофлот"" и т. д. nВ 2017 году Украина также ввела санкции в отношении российских компаний интернет- и медиаотрасли, таких как Mail. ru Group, ""Яндекс"", ""ВКонтакте"" и ""Одноклассники"".",Газпромбанк,Газпромбанк,sanctions,санкции,no_risk,mentioned_only,0,,ok,0,train,manual_checked,банк только упомянут
sample_000658,risk_enriched_sample,ods_tass,https://tass.ru/ekonomika/1778462,1424359904,2015,2,Альфа-банк просит суд назначить временного управляющего в авиакомпанию UTair,"Альфа-банк просит суд назначить временного управляющего в авиакомпанию UTair ЕКАТЕРИНБУРГ, 19 февраля. /ТАСС/.",Альфа-банк,Альфа-Банк,legal_regulatory,суд,no_risk,mentioned_only,0,,ok,0,train,manual_checked,банк только упомянут
sample_000659,risk_enriched_sample,ods_tass,https://tass.ru/ekonomika/1468574,1411739158,2014,9,"Акции ""Мечела"" упали на 13% в начале торгов на Московской бирже","Акции ""Мечела"" упали на 13% в начале торгов на Московской бирже /ИТАР-ТАСС/. Акции ""Мечела"" упали на 13%, до 13 руб., на открытии торгов Московской биржи после сообщения о том, что ВТБ подал иск к ""Мечелу"" на 2,99 млрд руб. nПо состоянию на 10.",ВТБ,ВТБ,legal_regulatory,иск,no_risk,mentioned_only,0,,ok,0,train,manual_checked,банк только упомянут
