sample_id,dataset_part,source,url,published_at,published_year,published_month,title,text_fragment,entity_mention,entity_norm,risk_type_candidate,found_risk_keywords,risk_type,entity_relevance,alert_flag,alert_reason,label_quality,risk_score_v1,split,review_status,review_comment
sample_000001,natural_sample,taiga_fontanka,http://www.fontanka.ru/2015/12/24/022/,1450948620,2015,12,«Трансаэро» через арбитраж пытается оспорить отзыв сертификата эксплуатанта,"«Трансаэро» через арбитраж пытается оспорить отзыв сертификата эксплуатанта Филев вышел из сделки в связи с тем, что другой ее участник, акционер «Трансаэро» Александр Плешаков, не набрал 51% акций, не обремененных претензиями кредиторов. 16 октября Сбербанк подал иск о банкротстве «Трансаэро», в дальнейшем такие же заявления подали ВТБ, Альфа-банк и Федеральная налоговая служба. 16 декабря Арбитражный суд Санкт-Петербурга и Ленинградской области запустил процедуру банкротства компании, признав обоснованным заявление Сбербанка.",Сбербанк,Сбербанк,legal_regulatory,иск; суд,no_risk,mentioned_only,0,,ok,0,train,manual_checked,банк только упомянут
sample_000003,natural_sample,telegram_contest,https://profile.ru/scitech/internet/evolyuciya-cifrovogo-spruta-195683/,1574035200,2019,11,Эволюция цифрового спрута,"Эволюция цифрового спрута Впрочем, такие интернет-гиганты в мире высоких технологий принято теперь называть экосистемами, эволюционирующими экономическими материями со множеством различных бизнесов в самых разных сферах, в центре которых главный бренд. Такими экосистемами стали Google, Amazon, Apple, Facebook, Сбербанк, Mail.ru. Эволюция цифровых экосистем оказалась столь бурной, что биологическое существо – человек – уже с трудом мыслит себя вне их.",Сбербанк,Сбербанк,no_risk,,no_risk,mentioned_only,0,,ok,0,train,manual_checked,банк только упомянут
sample_000004,natural_sample,buriy,http://www.interfax.ru/business/417923,1421295900,2015,1,Суд признал Змеиногорский винзавод на Алтае банкротом,"Суд признал Змеиногорский винзавод на Алтае банкротом Общая сумма долга винзавода перед пятью кредиторами составила 693,3 млн рублей. Среди основных кредиторов компании фигурирует Сбербанк, Россельхозбанк и Федеральная налоговая служба. Дело о банкротстве ""Змеиногорского виноводочного завода"" арбитраж открыл в августе 2013 года по заявлению Федеральной налоговой службы.",Россельхозбанк,Россельхозбанк,legal_regulatory,суд,no_risk,mentioned_only,0,,ok,0,train,manual_checked,банк только упомянут
sample_000005,natural_sample,telegram_contest,https://sibdepo.ru/news/rosselhozbank-zapustil-programmu-kreditovaniya-biznesa-na-vyplatu-zarabotnoj-platy-pod-0.html,1587958199,2020,4,Россельхозбанк запустил программу кредитования бизнеса на выплату заработной платы под 0%,Россельхозбанк запустил программу кредитования бизнеса на выплату заработной платы под 0% АО «Россельхозбанк» приступил к финансированию в рамках государственной программы кредитования на выплату заработной платы для малого и микробизнеса и индивидуальных предпринимателей. Банком приняты решения о финансировании по заявкам компаний и начаты выдачи кредитов.,Россельхозбанк,Россельхозбанк,no_risk,,no_risk,mentioned_only,0,,ok,0,train,manual_checked,банк только упомянут
sample_000006,natural_sample,ods_tass,https://tass.ru/proisshestviya/2509394,1449620718,2015,12,"Кехман просит об отводе судьи по делу JFC, заявив, что тот подсказывает Сбербанку","Кехман просит об отводе судьи по делу JFC, заявив, что тот подсказывает Сбербанку nЗаявление прозвучало в ходе рассмотрения в апелляции жалобы Кехмана на решение суда первой инстанции, который ранее признал банкротом его компанию по продаже бананов - ЗАО ""Группа Джей Эф Си"" и утвердил конкурсным управляющим Игоря Маслова из ассоциации МСРО ""Содействие"". n""Имеются основания предполагать, что (рассматривающий жалобу) судья подсказывал лицам, участвующим в деле, - представителям Сбербанка и МСРО - о необходимости отозвать поданные отзывы (на жалобу) с целью не откладывать (рассмотрение дела)"", - сказала представитель Кехмана в суде. nРанее она ходатайствовала об отложении рассмотрения дела, заявив, что Сбербанк представил свои пояснения только во вторник, а аналогичные документы ""Содействия"", отправленные почтой, не были доставлены. После вопросов судьи стороны решили не приобщать эти документы к делу, а заявить позицию устно.",Сбербанк,Сбербанк,customer_complaints,жалобы,no_risk,mentioned_only,0,,ok,0,train,manual_checked,банк только упомянут
sample_000008,natural_sample,lenta,https://lenta.ru/news/2016/11/22/pochta/,1479772800,2016,11,«Почта России» раскрыла данные о зарплате руководителя госкомпании,«Почта России» раскрыла данные о зарплате руководителя госкомпании Дмитрий Страшнов занимает пост гендиректора «Почты России» с апреля 2013 года. В январе текущего года он вошел в состав наблюдательного совета публичного акционерного общества (ПАО) Почта Банк.,Почта Банк,Почта Банк,no_risk,,no_risk,mentioned_only,0,,ok,0,train,manual_checked,банк только упомянут
sample_000009,natural_sample,ods_tass,https://tass.ru/ekonomika/6496053,1559348144,2019,6,"Банк ""ФК Открытие"" может выплатить ЦБ за 2018 год 2 млрд рублей дивидендов","Банк ""ФК Открытие"" может выплатить ЦБ за 2018 год 2 млрд рублей дивидендов МОСКВА, 31 мая. /ТАСС/.",ФК Открытие,Банк Открытие,no_risk,,no_risk,mentioned_only,0,,ok,0,train,manual_checked,банк только упомянут
sample_000010,natural_sample,buriy,http://top.rbc.ru/finances/15/07/2015/55a689959a7947f55e7b439f,1436980550,2015,7,ЦБ впервые назвал десятку системно значимых банков,"ЦБ впервые назвал десятку системно значимых банков Фото: Екатерина Кузьмина/РБК К банкам, оказывающим особое влияние на всю систему, регулятор, согласно сообщению его пресс-службы от 15 июля 2015 года, причислил Сбербанк, ВТБ, Россельхозбанк, Газпромбанк, ЮниКредит Банк, Райффайзенбанк, Росбанк, Альфа-банк, ФК «Открытие» и Промсвязьбанк. Это крупнейшие банки по размеру активов.",Промсвязьбанк,Промсвязьбанк,legal_regulatory,регулятор,no_risk,mentioned_only,0,,ok,0,train,manual_checked,банк только упомянут
sample_000011,natural_sample,telegram_contest,https://moika78.ru/news/2019-11-20/321741-liliya-agarkova-o-nedele-predprinimatelstva-vse-eto-pohozhe-na-pionerskij-lager/,1574239936,2019,11,Лилия Агаркова о Неделе предпринимательства: все это похоже на пионерский лагерь,"Лилия Агаркова о Неделе предпринимательства: все это похоже на пионерский лагерь Представители региональных хостелов сидели в первом ряду и ловили каждое слово отельеров культурной столицы. Остается добавить, что судя по логотипам первого листа из пачки программы, заплатили за все это удовольствие правительство Петербурга, Минэкономразвития, Центр оказания услуг «Мой бизнес», Банк Санкт-Петербург, и еще несколько спонсоров. Проведение такого мероприятия специалисты оценивают от 5-7 млн рублей.",Банк Санкт-Петербург,Банк Санкт-Петербург,no_risk,,no_risk,mentioned_only,0,,ok,0,train,manual_checked,банк только упомянут
sample_000012,natural_sample,lenta,https://lenta.ru/news/2016/04/15/rian_isk_yukos/,1460678400,2016,4,Парижский суд разблокировал счета «России сегодня» по делу ЮКОСа,"Парижский суд разблокировал счета «России сегодня» по делу ЮКОСа В феврале 2016-го холдинговая компания GML, представляющая интересы бывших акционеров нефтяной компании, оценивала стоимость арестованных во Франции российских активов в миллиард долларов. Среди них назывались деньги МИА «Россия сегодня» и «Госзагрансобственности» на счетах французской дочки ВТБ, а также задолженность компании Eutelsat перед «Космической связью». В июле 2014 года Третейский суд в Гааге признал, что Россия нарушала Энергетическую хартию и фактически конфисковала активы ЮКОСа.",ВТБ,ВТБ,legal_regulatory,суд,no_risk,mentioned_only,0,,ambiguous,0,train,manual_checked,риск относится не к банку
sample_000013,natural_sample,ods_tass,https://tass.ru/ekonomika/1813996,1425689113,2015,3,"""Мечел"" удивлен намерением ВТБ подать иск о банкротстве компании","""Мечел"" удивлен намерением ВТБ подать иск о банкротстве компании nВ настоящее время ""Мечел"" является одной из самых закредитованных российских металлургических компаний. По состоянию на 13 января 2015 года долг ""Мечела"", по данным компании, составлял 6,44 млрд долларов, из них около 70% приходится на три госбанка: Газпромбанк, Сбербанк и ВТБ. Сейчас горно-металлургический холдинг ведет сложные переговоры с кредиторами о реструктуризации долга.",Газпромбанк,Газпромбанк,legal_regulatory,иск,no_risk,mentioned_only,0,,ambiguous,0,train,manual_checked,риск относится не к банку
sample_000014,natural_sample,buriy,http://www.itar-tass.com/ekonomika/1438461?utm_medium=rss20,1410531231,2014,9,Греф: внешние рынки закрыты для российских банков,"Греф: внешние рынки закрыты для российских банков Сбербанк не исключает привлечения валютного фондирования от ЦБ, указал Греф. Как ранее сегодня сообщали ИТАР-ТАСС два источника, близкие к двум банкам, попавших под санкции (Сбербанк, ВТБ, Газпромбанк, РСХБ и ВЭБ), ужесточение санкций ЕС на российские банки не повлияет, занимать на западных рынках невозможно фактически с марта, когда геополитическая ситуация только начала ухудшаться. Рост ставок Вместе с тем, Сбербанк не исключает роста ставок по валютным вкладам и депозитам.",Газпромбанк,Газпромбанк,sanctions,санкции,sanctions,direct,1,"В публикации описаны санкции или ограничения, связанные с Газпромбанк.",ok,95,train,manual_checked,
sample_000017,natural_sample,taiga_fontanka,http://www.fontanka.ru/2010/02/02/051/,1265115720,2010,2,Банки потеряли 10 миллиардов,"Банки потеряли 10 миллиардов Три кредитные организации зафиксировали убыток, одна («Петро-Аэро-банк») прекратила существование. Но доходность потеряли практически все лидеры рынка: прибыль «ВТБ Северо-Запад» (бывший ПСБ) сократилась в три с половиной раза, банка «Санкт-Петербург» - более чем в два раза. С убытком в 10,2 млрд рублей закончил год «КИТ Финанс», который в течение нескольких предшествующих кризису лет лидировал по росту прибыли.",ПСБ,Промсвязьбанк,no_risk,,no_risk,mentioned_only,0,,ok,0,train,manual_checked,банк только упомянут
sample_000019,natural_sample,ods_tass,https://tass.ru/ekonomika/5380787,1531849351,2018,7,"В ВТБ заявили, что личные данные клиентов не попадали в открытый доступ","В ВТБ заявили, что личные данные клиентов не попадали в открытый доступ МОСКВА, 17 июля. /ТАСС/.",ВТБ,ВТБ,data_leak_security,данные клиентов,data_leak_security,direct,1,В публикации обсуждается риск утечки данных клиентов ВТБ.,ok,100,train,manual_checked,
sample_000020,natural_sample,ods_tass,https://tass.ru/ekonomika/4128417,1490638061,2017,3,"Два отделения Сбербанка на Украине возобновили работу, три остаются заблокированы","Два отделения Сбербанка на Украине возобновили работу, три остаются заблокированы Радикалы блокируют вход в финучреждения, строят у дверей баррикады, обливают краской окна и двери, призывая украинцев забирать из банков деньги. nПод давлением националистов президент Петр Порошенко 16 марта ввел в действие санкции в отношении пяти банков с российским капиталом (Сбербанк, Проминвестбанк, ВТБ, БМ Банк и VS Bank) сроком на год. Санкции предполагают, в частности, запрет на вывод средств за пределы Украины, а также на выплату дивидендов, процентов, возвращения межбанковских депозитов и кредитов, средств с корреспондентских счетов субординированного долга.",Сбербанк,Сбербанк,sanctions,санкции,sanctions,direct,1,"В публикации описаны санкции или ограничения, связанные с Сбербанк.",ok,95,train,manual_checked,
sample_000021,natural_sample,telegram_contest,http://www.finmarket.ru/analytics/5121183,1574329860,2019,11,Цены рублевых корпоративных бондов в четверг могут слегка снизиться,Цены рублевых корпоративных бондов в четверг могут слегка снизиться Ставка первого купона установлена на уровне 13% годовых. Совкомбанк планирует 22 ноября провести размещение 3-летних облигаций серии FIZL1 объемом 500 млн рублей. Выпуск будет размещен по открытой подписке.,Совкомбанк,Совкомбанк,no_risk,,no_risk,mentioned_only,0,,ok,0,train,manual_checked,банк только упомянут
sample_000022,natural_sample,lenta,https://lenta.ru/news/2014/08/22/sanctions/,1408665600,2014,8,США предложили Китаю поддержать санкции против России,"США предложили Китаю поддержать санкции против России При этом он заявил, что сожалеет о том, что дело дошло до санкций, и высказал пожелание, чтобы Москва и Вашингтон вернулись к «более конструктивным отношениям». В конце июля Соединенные Штаты ввели секторальные санкции против российских компаний «Новатэк», «Роснефть», Внешэкономбанк, Газпромбанк, «Банк Москвы», ВТБ, Россельхозбанк из-за политики Москвы в отношении Киева. Активы этих компаний не будут заморожены, но американским компаниям и гражданам отныне запрещено инвестировать в новые акции и облигации этих структур.",Россельхозбанк,Россельхозбанк,sanctions,санкции,sanctions,direct,1,"В публикации описаны санкции или ограничения, связанные с Россельхозбанк.",ok,95,train,manual_checked,
sample_000025,natural_sample,taiga_fontanka,http://www.fontanka.ru/2016/08/03/074/,1470228720,2016,8,Банкоматы Альфа-Банка установлены на станциях Санкт-Петербургского метрополитена,"Банкоматы Альфа-Банка установлены на станциях Санкт-Петербургского метрополитена Уверен, что жители и гости Санкт-Петербурга по достоинству оценят удобство работы с Альфа-Банком без дополнительных временных затрат на дорогу к отделению банка или к ближайшему банкомату», — говорит начальник управления по развитию систем самообслуживания Альфа-Банка Максим Дарёшин. На сегодняшний день у Альфа-Банка общая объединенная банкоматная сеть с действующими партнёрами, а это: Промсвязьбанк, МДМ Банк, Росбанк, УБРиР, Россельхозбанк, МОСКОВСКИЙ КРЕДИТНЫЙ БАНК, Газпромбанк и БИНБАНК насчитывает более 24,7 тысяч устройств, расположенных более чем в 2,8 тыс. населённых пунктов России. А с МДМ Банком, УБРиР, МОСКОВСКИМ КРЕДИТНЫМ БАНКОМ (только для физических лиц) и с БИНБАНКОМ Альфа-Банк сотрудничает ещё и на внесение наличных.",Россельхозбанк,Россельхозбанк,no_risk,,no_risk,mentioned_only,0,,ok,0,train,manual_checked,банк только упомянут
sample_000027,natural_sample,lenta,https://lenta.ru/news/2019/08/15/depo/,1565827200,2019,8,Ставки по рублевым вкладам резко опустились,"Ставки по рублевым вкладам резко опустились На ситуацию повлияли снижения в июне и июле ключевой ставки ЦБ до итоговых 7,25 процента годовых. В топ-10 российских банков по объемам рублевых вкладов населения на данный момент входят Альфа-Банк, ВТБ, Газпромбанк, Московский Кредитный Банк, «Открытие», Промсвязьбанк, Райффайзенбанк, Россельхозбанк, Сбербанк, Совкомбанк. Самое низкое значение максимальной ставки по вкладам в России зафиксировано в июне 2018 года (6,05 процента), самое высокое — в декабре 2014-го (15,635 процента).",Промсвязьбанк,Промсвязьбанк,no_risk,,no_risk,mentioned_only,0,,ok,0,train,manual_checked,банк только упомянут
sample_000028,natural_sample,buriy,http://top.rbc.ru/business/18/12/2014/5492d0a59a794767301cc0c7,1418908524,2014,12,Задолженность авиакомпании Utair превысила 167 млрд руб.,"Задолженность авиакомпании Utair превысила 167 млрд руб. Большая часть долга (более 90%) номинирована в иностранной валюте. Один из крупнейших кредиторов – Альфа-банк – подал несколько исков к Utair, требуя с него $42,4 млн (и проценты $510 тыс.) и 116 млн руб. (и проценты 545 тыс. руб.). Другим крупнейшим кредитором, который подал иски в суд, является лизинговая компания «ЮГРА СПб», долг перед которой составляет 1,3 млрд руб.",Альфа-банк,Альфа-Банк,legal_regulatory,суд,no_risk,mentioned_only,0,,ok,0,train,manual_checked,банк только упомянут
