sample_id,dataset_part,source,url,published_at,published_year,published_month,title,text_fragment,entity_mention,entity_norm,risk_type_candidate,found_risk_keywords,risk_type,entity_relevance,alert_flag,alert_reason,label_quality,risk_score_v1,split,review_status,review_comment
sample_000406,natural_sample,telegram_contest,https://akket.com/raznoe/209805-alfa-bank-skrytno-vvel-komissiyu-dlya-vseh-vladeltsev-bankovskih-kart.html,1588350669,2020,5,«Альфа-Банк» скрытно ввел комиссию для всех владельцев банковских карт,"«Альфа-Банк» скрытно ввел комиссию для всех владельцев банковских карт Одним из самых крупных банков на территории России является «Альфа-Банк», который стремится делать все ради привлечения клиентов и расширения своего бизнеса. Тем не менее, в последние годы данная компания снова и снова без лишней публичной огласки меняет условия обслуживания в худшую сторону, публикуя такого рода сведения на своем официальном сайте с расчетом на то, что миллионы клиентов, пользующихся ее услугами, посещают этот самый ресурс каждый день.",Альфа-Банк,Альфа-Банк,no_risk,,no_risk,mentioned_only,0,,ok,0,train,manual_checked,банк только упомянут
sample_000407,natural_sample,ods_tass,https://tass.ru/ekonomika/5724868,1540577628,2018,10,Максимальная ставка по рублевым вкладам во II декаде октября превысила 7%,"Максимальная ставка по рублевым вкладам во II декаде октября превысила 7% nВ первой декаде октября ставка находилась на уровне 6,8%. nВ число банков, данные которых ЦБ использует для мониторинга ставок, входят Сбербанк, Московский кредитный банк, ВТБ, Райффайзенбанк, Газпромбанк, Бинбанк, Альфа- банк, банк ""ФК Открытие"", Промсвязьбанк и Россельхозбанк.",Промсвязьбанк,Промсвязьбанк,no_risk,,no_risk,mentioned_only,0,,ok,0,train,manual_checked,банк только упомянут
sample_000408,natural_sample,ods_tass,https://tass.ru/ekonomika/1538400,1414546537,2014,10,Европейский суд общей юрисдикции подтвердил получение иска от ВТБ против введенных санкций,"Европейский суд общей юрисдикции подтвердил получение иска от ВТБ против введенных санкций Европейский суд общей юрисдикции зарегистрировал иск российского банка ВТБ против санкций Евросоюза. Эту информацию ТАСС подтвердили в пресс-службе суда. n12 сентября Евросоюз ввел санкции против ряда крупнейших российских финансовых институтов, среди которых ВТБ, Сбербанк, Газпромбанк, Россельхозбанк, Внешэкономбанк. Европейским инвесторам запрещается выдавать им новые кредиты на срок более 30 дней, а также покупать их акции и облигации из новых выпусков со сроком обращения более 30 дней.",Сбербанк,Сбербанк,sanctions,суд; иск; санкции,no_risk,mentioned_only,0,,ok,0,train,manual_checked,банк только упомянут
sample_000409,natural_sample,telegram_contest,https://glasnarod.ru/novosti/25-ekonomika/290821-obzor-na-nedelyu-s-9-po-13-dekabrya-2019-goda-zhdyom-ot-rossijskogo-rynka-popytki-dalnejshego-rosta,1575883800,2019,12,Обзор на неделю с 9 по 13 декабря 2019 года. Ждём от российского рынка попытки дальнейшего роста,"Обзор на неделю с 9 по 13 декабря 2019 года. Ждём от российского рынка попытки дальнейшего роста После публикации заявления состоится пресс-конференция председателя Дж. Пауэлла. В России Сбербанк проведёт день аналитика. Бумаги «Юнипро» будут торговаться последний день с дивидендами 0,111 рублей на акцию.",Сбербанк,Сбербанк,no_risk,,no_risk,mentioned_only,0,,ok,0,train,manual_checked,банк только упомянут
sample_000410,natural_sample,ods_tass,https://tass.ru/ekonomika/5153521,1524590519,2018,4,"ЦБ и Минфин обсуждают дополнительную поддержку банков, кредитующих санкционные компании","ЦБ и Минфин обсуждают дополнительную поддержку банков, кредитующих санкционные компании nКак заявил министр финансов РФ Антон Силуанов, попавшие под санкции компании запросили ликвидность на 100 млрд рублей. По его словам, поддержка может быть оказана через Промсвязьбанк, на базе которого создается опорный банк для гособоронзаказа и крупных госконтрактов.",Промсвязьбанк,Промсвязьбанк,sanctions,санкции,sanctions,indirect,0,,ambiguous,45,train,manual_checked,риск относится не к банку
sample_000411,natural_sample,telegram_contest,https://pravo.ru/news/221237/,1588168747,2020,4,В ВТБ предупредили об активизации мошенников-«домушников»,"В ВТБ предупредили об активизации мошенников-«домушников» Россияне стали более осмотрительными и не сообщают свои персональные данные по телефону, поэтому мошенники начали возвращаться к прежним способам выманивания денег, сообщили в кредитной организации. В ВТБ зафиксировали рост активности мошенников, которые обходят квартиры под видом кредитных агентов, консультантов или риелторов и предлагают свои «услуги» по оформлению финансовых продуктов и заключению банковских договоров, говорится в сообщении банка.",ВТБ,ВТБ,data_leak_security,персональные данные,no_risk,mentioned_only,0,,ok,0,train,manual_checked,банк только упомянут
sample_000412,natural_sample,taiga_fontanka,http://www.fontanka.ru/2008/12/15/120/,1229371440,2008,12,Удачин спасает «Парнас» через банкротство,"Удачин спасает «Парнас» через банкротство Однако эти заявления выглядят весьма смелыми на фоне той финансовой обстановки, что сложилась на предприятии. Ведь Арбитражный суд продолжает рассматривать иски к «Парнасу» от десятков кредиторов, в числе которых - «Россельхозбанк», «Номос-Банк», банк «Санкт-Петербург» и другие. Как внешние управляющие будут решать вопросы с этими структурами, пока не уточняется.",Россельхозбанк,Россельхозбанк,legal_regulatory,суд,no_risk,mentioned_only,0,,ok,0,train,manual_checked,банк только упомянут
sample_000414,natural_sample,lenta,https://lenta.ru/news/2009/05/25/fraud/,1243209600,2009,5,Бывшего главу российских кооператоров обвинили в мошенничестве,"Бывшего главу российских кооператоров обвинили в мошенничестве Однако в 2004 году Центробанк РФ решил оспорить права на акции, и в ноябре 2006 года российский арбитражный суд признал собственником акций Российскую Федерацию. В 2005 году ЦБ РФ передал акции всех российских загранбанков на баланс ВТБ, поскольку считает себя 100-процентным владельцем этих банков. В Центробанке называют миноритарных акционеров номинальными держателями акций, поскольку они не вносили никаких средств в капиталы загранбанков.",ВТБ,ВТБ,legal_regulatory,суд,no_risk,mentioned_only,0,,ambiguous,0,train,manual_checked,риск относится не к банку
sample_000416,natural_sample,lenta,https://lenta.ru/news/2019/08/15/depo/,1565827200,2019,8,Ставки по рублевым вкладам резко опустились,"Ставки по рублевым вкладам резко опустились На ситуацию повлияли снижения в июне и июле ключевой ставки ЦБ до итоговых 7,25 процента годовых. В топ-10 российских банков по объемам рублевых вкладов населения на данный момент входят Альфа-Банк, ВТБ, Газпромбанк, Московский Кредитный Банк, «Открытие», Промсвязьбанк, Райффайзенбанк, Россельхозбанк, Сбербанк, Совкомбанк. Самое низкое значение максимальной ставки по вкладам в России зафиксировано в июне 2018 года (6,05 процента), самое высокое — в декабре 2014-го (15,635 процента).",Совкомбанк,Совкомбанк,no_risk,,no_risk,mentioned_only,0,,ok,0,train,manual_checked,банк только упомянут
sample_000417,natural_sample,lenta,https://lenta.ru/news/2012/04/17/yacards/,1334620800,2012,4,"""Яндекс.Деньги"" выпустят банковские карты","""Яндекс.Деньги"" выпустят банковские карты Операции напрямую со счетом (к примеру, оплата в магазинах) также будут осуществляться бесплатно, а комиссия за снятие наличных составит три процента от суммы плюс 15 рублей. Эмитирует карты банк ""Тинькофф Кредитные Системы"". Оставить заявку на оформление карты пользователи ""Яндекс.",Тинькофф,Т-Банк,no_risk,,no_risk,mentioned_only,0,,ok,0,train,manual_checked,банк только упомянут
sample_000418,natural_sample,buriy,http://inosmi.ru/economic/20150129/225911229.html,1422532920,2015,1,Русские пропали,"Русские пропали Попавшая под санкции «Роснефть» лишилась возможности привлекать финансы за границей и объявила об отмене покупки нефтетрейдингового бизнеса Morgan Stanley. Альфа-банк прекращает свою деятельность в Нью-Йорке. Политическое давление Западные санкции, введенные в связи с ситуацией на Украине, изначально приводили к тому, что российская олигархия вывозила капиталы из России.",Альфа-банк,Альфа-Банк,sanctions,санкции,no_risk,mentioned_only,0,,ok,0,train,manual_checked,банк только упомянут
sample_000419,natural_sample,lenta,https://lenta.ru/news/2019/05/31/obliga/,1559260800,2019,5,Минфин захотел активнее брать в долг у россиян,"Минфин захотел активнее брать в долг у россиян Об этом пишет принадлежащая семье Демьяна Кудрявцева газета «Ведомости». Для этого ведомство собирается задействовать банки-агенты по продаже бумаг: Сбербанк, ВТБ, Промсвязьбанк и Почта банк. Кроме обычной рекламы на телевидении, радио и в интернете Минфин собирается использовать социальные сети.",Промсвязьбанк,Промсвязьбанк,no_risk,,no_risk,mentioned_only,0,,ok,0,train,manual_checked,банк только упомянут
sample_000420,natural_sample,ods_tass,https://tass.ru/ekonomika/1979467,1432063885,2015,5,Альфа-банк подал заявку в АСВ на докапитализацию через ОФЗ примерно на 62 млрд рублей,"Альфа-банк подал заявку в АСВ на докапитализацию через ОФЗ примерно на 62 млрд рублей nПозже премьер-министр РФ Дмитрий Медведев утвердил список из восьми банков для получения средств в капитал первого уровня на общую сумму 527,4 млрд рублей. nВ список банков, которые могут пополнить капитал первого уровня за счет АСВ, вошли ВТБ, Газпромбанк (ГПБ), Россельхозбанк (РСХБ), банк ""Российский капитал"", АБ ""Содействие общественным инициативам"", а также попавшие под санкции АБ ""Россия"", СМП-Банк и крымский РНКБ. nБольшую часть средств получит ВТБ - 307,4 млрд рублей.",ВТБ,ВТБ,sanctions,санкции,no_risk,mentioned_only,0,,ok,0,train,manual_checked,банк только упомянут
sample_000421,natural_sample,lenta,https://lenta.ru/news/2017/07/17/quit/,1500249600,2017,7,Крупнейшие российские банки покинули АРБ,"Крупнейшие российские банки покинули АРБ Крупнейшие российские кредитные организации — Сбербанк, ВТБ, ВТБ 24, «Открытие», Россельхозбанк, Газпромбанк, Бинбанк и Альфа-банк — объявили о выходе из Ассоциации российских банков (АРБ). Об этом в понедельник, 17 июля, сообщает Rambler News Service В последние годы эффективность деятельности АРБ неуклонно снижается, считают в финансовых учреждениях.",Россельхозбанк,Россельхозбанк,no_risk,,no_risk,mentioned_only,0,,ok,0,train,manual_checked,банк только упомянут
sample_000422,natural_sample,lenta,https://lenta.ru/news/2010/07/02/wild/,1278028800,2010,7,"Суд не стал банкротить ""Дикую орхидею""","Суд не стал банкротить ""Дикую орхидею"" Ранее сообщалось, что ""Дикая орхидея"" оказалась в сложном финансовом положении из-за кризиса. В частности, компании пришлось заложить в Сбербанк контрольный пакет акций предприятия. ""Дикая орхидея"" - одна из крупнейших российских сетей по продаже нижнего белья.",Сбербанк,Сбербанк,legal_regulatory,суд,no_risk,mentioned_only,0,,ambiguous,0,train,manual_checked,риск относится не к банку
sample_000423,natural_sample,lenta,https://lenta.ru/news/2014/07/17/stock/,1405555200,2014,7,Рынок акций начал день снижением на фоне новых санкций против России,"Рынок акций начал день снижением на фоне новых санкций против России Под них попали вице-спикер Госдумы Сергей Неверов, помощник президента России Игорь Щеголев, федеральный министр по делам Крыма Олег Савельев, генерал-полковник ФСБ Сергей Беседа, а также премьер-министр ДНР Александр Бородай. Секторальные санкции наложены на компании «Новатэк», «Роснефть», Внешэкономбанк и Газпромбанк. Ограничения коснулись и ряда компаний российского ОПК.",Газпромбанк,Газпромбанк,sanctions,санкции; ограничения,sanctions,indirect,0,,ambiguous,45,train,manual_checked,риск относится не к банку
sample_000425,natural_sample,buriy,http://www.ura.ru/content/tumen/08-10-2014/articles/1036263143.html,1412782980,2014,10,"&laquo;Фактура есть, а&nbsp;воли нет&raquo;","&laquo;Фактура есть, а&nbsp;воли нет&raquo; Источники, близкие к Валерию Жукову, утверждают, что он поклялся, что вернет эти 5 млн, но для того, чтобы это осуществить, нужны были деньги. Жуков выбрал самый простой способ — кредит в «МТС Банк». Жизнь обнальщика скучной не бывает: пять минут — и ты сказочно богат.",МТС Банк,МТС Банк,no_risk,,no_risk,mentioned_only,0,,ok,0,train,manual_checked,банк только упомянут
sample_000427,natural_sample,buriy,http://www.interfax.ru/business/440052,1430830200,2015,5,"Газпромбанк и РСХБ самоустранились от проекта ""Едим дома!""","Газпромбанк и РСХБ самоустранились от проекта ""Едим дома!"" На проект Кончаловского и Михалкова могут дать деньги государственные Сбербанк и ВТБ с ""дочкой"" Банком Москвы, а также Промсвязьбанк братьев Ананьевых Москва. 5 мая.",Промсвязьбанк,Промсвязьбанк,no_risk,,no_risk,mentioned_only,0,,ok,0,train,manual_checked,банк только упомянут
sample_000430,natural_sample,telegram_contest,https://ura.news/news/1052408720,1574701560,2019,11,"Сын миллиардера, который помог Ельцину выиграть выборы, вспомнил, как заработал первые деньги. ВИДЕО","Сын миллиардера, который помог Ельцину выиграть выборы, вспомнил, как заработал первые деньги. ВИДЕО Я пошел с сумкой в школу, расфасовывал бутылки по шкафчикам в раздевалке, записывал для каждого код, и продавал непосредственно коды», — заключил юноша. Александр Фридман — прямой наследник своего отца, миллиардера Михаила Фридмана, которому принадлежит «Альфа банк». Также миллиардер помог выиграть выборы 1996 года Борису Ельцину.",Альфа банк,Альфа-Банк,no_risk,,no_risk,mentioned_only,0,,ok,0,train,manual_checked,банк только упомянут
sample_000431,natural_sample,taiga_fontanka,http://www.fontanka.ru/2016/11/03/039/,1478170200,2016,11,Пятый лот ЖК «Капитал» аккредитован «Газпромбанком»,"Пятый лот ЖК «Капитал» аккредитован «Газпромбанком» «Газпромбанк» аккредитовал пятый лот жилого комплекса комфорт-класса «Капитал», который строится компанией «Строительный трест» в Кудрово, по программе «Ипотека с государственной поддержкой». Сдача 5 лота ЖК «Капитал» намечена на 2 квартал 2018 года.",Газпромбанк,Газпромбанк,no_risk,,no_risk,mentioned_only,0,,ok,0,train,manual_checked,банк только упомянут
sample_000432,natural_sample,telegram_contest,https://pg21.ru/news/61078,1574697060,2019,11,Банк «Открытие» предоставил правительству Чувашской Республики кредит на 1 млрд рублей,Банк «Открытие» предоставил правительству Чувашской Республики кредит на 1 млрд рублей ПАО Банк «ФК Открытие» открыл кредитную линию на покрытие дефицита бюджета Чувашской Республики В ноябре 2019 года ПАО Банк ФК «Открытие» стал единственным участником аукциона регионального министерства на право открытия региону кредитной линии на 1 млрд рублей. По итогам аукциона предусмотрено исполнение долговых обязательств в срок два года с даты подписания контракта.,ФК Открытие,Банк Открытие,no_risk,,no_risk,mentioned_only,0,,ok,0,train,manual_checked,банк только упомянут
sample_000433,natural_sample,ods_tass,https://tass.ru/ekonomika/1347499,1406656988,2014,7,"Глава Райффайзенбанка: санкции против Москвы ударят не только по РФ, но и по Украине и ЕС","Глава Райффайзенбанка: санкции против Москвы ударят не только по РФ, но и по Украине и ЕС Сейчас мы следим за тем, как развивается ситуация"", - прокомментировал Севельда. n17 июля США ввели третий пакет санкций в отношении России в связи с ситуацией на Украине. nОграничения коснулись секторов экономики: в список попали Внешэкономбанк, Газпромбанк, компания ""Роснефть"", концерн ""Калашников"", компания ""Уралвагонзавод"", ОАО ""НОВАТЭК"" и др. Однако в отличие от первых двух волн санкций в отношении банковского сектора, Газпромбанк и Внешэкономбанк были ограничены только в возможностях привлечения средств с внешних рынков, а именно по срокам выше 90 дней.",Газпромбанк,Газпромбанк,sanctions,санкции,sanctions,indirect,0,,ambiguous,45,train,manual_checked,риск относится не к банку
